[
  {
    "incident_id": "INC_0001_001",
    "timestamp": "2026-09-16T07:25",
    "timestamp_is_synthetic": true,
    "node_id": "M18",
    "node_type": "machine",
    "dataset": "ai4i",
    "source_row_id": 70,
    "source_row_pos": 69,
    "failure_mode": "PWF",
    "anomaly_type": "Nguồn / công suất",
    "severity": "Cao",
    "severity_score": 1.0,
    "anomaly_score": 0.8821,
    "detected": true,
    "suspected_cause_group": "Nguồn / công suất"
  },
  {
    "incident_id": "INC_0001_002",
    "timestamp": "2026-09-16T08:43",
    "timestamp_is_synthetic": true,
    "node_id": "M05",
    "node_type": "machine",
    "dataset": "ai4i",
    "source_row_id": 8691,
    "source_row_pos": 8690,
    "failure_mode": "TWF",
    "anomaly_type": "Mòn dao cụ",
    "severity": "Thấp",
    "severity_score": 0.6,
    "anomaly_score": 0.8688,
    "detected": true,
    "suspected_cause_group": "Mòn dao cụ"
  },
  {
    "incident_id": "INC_0001_003",
    "timestamp": "2026-09-16T09:48",
    "timestamp_is_synthetic": true,
    "node_id": "M11",
    "node_type": "machine",
    "dataset": "ai4i",
    "source_row_id": 4154,
    "source_row_pos": 4153,
    "failure_mode": "HDF",
    "anomaly_type": "Tản nhiệt kém",
    "severity": "Cao",
    "severity_score": 0.9,
    "anomaly_score": 0.8709,
    "detected": true,
    "suspected_cause_group": "Tản nhiệt kém"
  },
  {
    "incident_id": "INC_0001_004",
    "timestamp": "2026-09-16T11:56",
    "timestamp_is_synthetic": true,
    "node_id": "M14",
    "node_type": "machine",
    "dataset": "ai4i",
    "source_row_id": 4410,
    "source_row_pos": 4409,
    "failure_mode": "HDF",
    "anomaly_type": "Tản nhiệt kém",
    "severity": "Cao",
    "severity_score": 0.9,
    "anomaly_score": 0.7596,
    "detected": true,
    "suspected_cause_group": "Tản nhiệt kém"
  },
  {
    "incident_id": "INC_0001_005",
    "timestamp": "2026-09-16T14:21",
    "timestamp_is_synthetic": true,
    "node_id": "M07",
    "node_type": "machine",
    "dataset": "ai4i",
    "source_row_id": 3001,
    "source_row_pos": 3000,
    "failure_mode": "PWF",
    "anomaly_type": "Nguồn / công suất",
    "severity": "Cao",
    "severity_score": 1.0,
    "anomaly_score": 0.8646,
    "detected": true,
    "suspected_cause_group": "Nguồn / công suất"
  },
  {
    "incident_id": "INC_0001_006",
    "timestamp": "2026-09-16T14:28",
    "timestamp_is_synthetic": true,
    "node_id": "M17",
    "node_type": "machine",
    "dataset": "ai4i",
    "source_row_id": 2427,
    "source_row_pos": 2426,
    "failure_mode": "PWF",
    "anomaly_type": "Nguồn / công suất",
    "severity": "Cao",
    "severity_score": 1.0,
    "anomaly_score": 0.8644,
    "detected": true,
    "suspected_cause_group": "Nguồn / công suất"
  }
]